#,Title, Address,latitude,longitude,Category
1,krishna plumbing an,"uvb010 udyog vihar building material market, Greater Noida, Uttar Pradesh 201...",28.5011395,77.4730653,Plumber
2,A To Z Plumbing Sol...,,28.5471548,77.2987676,Plumber
3,Rana Plumbing Solut...,,28.50562,77.2093115,Plumber
4,Indirapurarn Plumber...,"Shop 100, Sukra Chauk, Nyay Khand Ill, Indirapuram, Ghaziabad, Uttar Pradesh ...",28.6429851,77.3596396,Plumber
5,All Plumbing-Plumbe...,,28.5332022,77.2942823,Plumber
6,All Type Plumbring,"Shop No. 131, Atta Market, Captain Vijyant Thapar Marg, Pocket E, Sector 27, N...",28.5728403,77.3242689,Plumber
8,Plumbing pk,"V-82, 11 Colony, Sector 4, Noida, Uttar Pradesh 201301",28.5833321,77.3229411,Plumber
9,Plumber solution,"H8RPTC26, D Block, Sector 62, Noida, Uttar Pradesh 201301",28.5910673,77.335033,Plumber
10,Mahender Singh Sa...,"Shop No.284 , Pusta Road Aali Village, Subhash Camp, Gautampuri Awas, Bada...",28.5155818,77.3026513,Plumber
